TITULO DEL PROYECTO,MUNICIPIO,FECHA,CATEGORIA,Unnamed: 4,COORDENADAS,LAT,LON,LAT_MUNICIPIO,LON_MUNICIPIO,LAT_GENERADA,LON_GENERADA
APOYO TECNOLÓGICO AL “PROYECTO PILOTO DE INFORMACIÓN SOBRE ACCESIBILIDAD PARA SU INCORPORACIÓN EN PLATAFORMA INSULAR” EN PARA EL ÁREA DE ACCESIBILIDAD DE LA SOCIEDAD INSULAR PARA LA PROMOCIÓN DE LAS PERSONAS CON DISCAPACIDAD S.L.,SANTA CRUZ DE TENERIFE,2017,SISTEMAS DE INFORMACION GEOGRAFICA Y CARTOGRAFICA,,"28.679565, -16.241129",28.679565,-16.241129,28.583479893617024,-16.33721410638298,28.583479893617024,-16.33721410638298
PRESTACIÓN DE SERVICIOS DOCENTES DE LA ACCIÓN FORMATIVA INICIACIÓN A LOS SISTEMAS DE INFORMACIÓN GEOGRÁFICA: QGIS PARA PROYECTOS DE ACCESIBILIDAD,SANTA CRUZ DE TENERIFE,2016,SISTEMAS DE INFORMACION GEOGRAFICA Y CARTOGRAFICA,,"28.681565, -16.239129",28.681565,-16.239129,28.583479893617024,-16.33721410638298,28.583479893617024,-16.33721410638298
ACTUALIZACIÓN DE LA DIGITALIZACIÓN DE LA MUESTRA ESTADÍSTICA DE ESTABLECIMIENTOS TURÍSTICOS DE LA ISLA DE TENERIFE,SANTA CRUZ DE TENERIFE,2012,SISTEMAS DE INFORMACION GEOGRAFICA Y CARTOGRAFICA,,"28.683565, -16.237129",28.683565,-16.237129,28.583479893617024,-16.33721410638298,28.583479893617024,-16.33721410638298
"GEORREFERENCIACIÓN DE LAS VALLAS PUBLICITARIAS EN EL ENTORNO DEL ÁREA METROPOLITANA DE TENERIFE, GESTIÓN DE GOOGLE MAPS, GOOGLE EARTH Y ELABORACIÓN DE MAPAS CON INFORMACIÓN DE INTERÉS PARA CONTRATANTES",SANTA CRUZ DE TENERIFE,2011,SISTEMAS DE INFORMACION GEOGRAFICA Y CARTOGRAFICA,,"28.685565, -16.235129",28.685565,-16.235129,28.583479893617024,-16.33721410638298,28.583479893617024,-16.33721410638298
REVISIÓN DE LOS CONTENIDOS DE LA SECCIÓN ATLAS DIGITAL DEL SITIO,SANTA CRUZ DE TENERIFE,2011,SISTEMAS DE INFORMACION GEOGRAFICA Y CARTOGRAFICA,,"28.687565, -16.233129",28.687565,-16.233129,28.583479893617024,-16.33721410638298,28.583479893617024,-16.33721410638298
"GEORREFERENCIACIÓN DE LOS HITOS DE LAS DOCE RUTAS EN COCHE EDITADAS POR TENERIFE RURAL, TANTO EN GOOGLE MAPS COMO EN FOURSQUARE",SANTA CRUZ DE TENERIFE,2011,SISTEMAS DE INFORMACION GEOGRAFICA Y CARTOGRAFICA,,"28.689565, -16.231129",28.689565,-16.231129,28.583479893617024,-16.33721410638298,28.583479893617024,-16.33721410638298
DIGITALIZACIÓN DE LA INFORMACIÓN DE LA PÁGINA WEB www.todotenerife.es,SANTA CRUZ DE TENERIFE,2009,SISTEMAS DE INFORMACION GEOGRAFICA Y CARTOGRAFICA,,"28.691565, -16.229129",28.691565,-16.229129,28.583479893617024,-16.33721410638298,28.583479893617024,-16.33721410638298
DIAGNÓSTICO DE LA WEB DEL BANCO DE DATOS DEL CABILDO DE TENERIFE,SANTA CRUZ DE TENERIFE,2007,SISTEMAS DE INFORMACION GEOGRAFICA Y CARTOGRAFICA,,"28.693565, -16.227129",28.693565,-16.227129,28.583479893617024,-16.33721410638298,28.583479893617024,-16.33721410638298
DIGITALIZACIÓN DE LA MUESTRA ESTADÍSTICA DE ESTABLECIMIENTOS TURÍSTICOS DE LA ISLA DE TENERIFE,SANTA CRUZ DE TENERIFE,2006,SISTEMAS DE INFORMACION GEOGRAFICA Y CARTOGRAFICA,,"28.695565, -16.225129",28.695565,-16.225129,28.583479893617024,-16.33721410638298,28.583479893617024,-16.33721410638298
ANÁLISIS DE LA INFORMACIÓN TERRITORIAL EXISTENTE DENTRO DEL CABILDO DE TENERIFE SUSCEPTIBLE DE FORMAR PARTE DE LA FUTURA INICIATIVA ATLAS DE TENERIFE,SANTA CRUZ DE TENERIFE,2005,SISTEMAS DE INFORMACION GEOGRAFICA Y CARTOGRAFICA,,"28.697565, -16.223129",28.697565,-16.223129,28.583479893617024,-16.33721410638298,28.583479893617024,-16.33721410638298
GEORREFERENCIACIÓN DE LOS RECURSOS CONTENIDOS EN LA GUÍA DE RECURSOS SOCIALES Y SOCIOSANITARIOS DE TENERIFE,SANTA CRUZ DE TENERIFE,2003,SISTEMAS DE INFORMACION GEOGRAFICA Y CARTOGRAFICA,,"28.699565, -16.221129",28.699565,-16.221129,28.583479893617024,-16.33721410638298,28.583479893617024,-16.33721410638298
DISEÑO DE PROPUESTA DE ARCHIVO Y LOCALIZACIÓN DE LA INFORMACIÓN DIGITAL DEL SISTEMA DE INFORMACIÓN GEOGRÁFICA DEL CABILDO DE TENERIFE,SANTA CRUZ DE TENERIFE,2003,SISTEMAS DE INFORMACION GEOGRAFICA Y CARTOGRAFICA,,"28.701565, -16.219129",28.701565,-16.219129,28.583479893617024,-16.33721410638298,28.583479893617024,-16.33721410638298
DISEÑO DE PROPUESTA DE BASE DE DATOS (METADATO) DE DESCRIPCIÓN DE LAS CARACTERÍSTICAS DE LA INFORMACIÓN EXISTENTE EN EL MOTOR GEOGRÁFICO DEL CABILDO DE TENERIFE (INTRAMAP),SANTA CRUZ DE TENERIFE,2002,SISTEMAS DE INFORMACION GEOGRAFICA Y CARTOGRAFICA,,"28.703565, -16.217129",28.703565,-16.217129,28.583479893617024,-16.33721410638298,28.583479893617024,-16.33721410638298
INCERSIÓN DE LOS DATOS DE EMPLAZAMIENTO DE VÍAS Y NÚMEROS DE EDIFICIOS EN LA CARTOGRAFÍA DIGITAL DE CANARIAS,SANTA CRUZ DE TENERIFE,2001,SISTEMAS DE INFORMACION GEOGRAFICA Y CARTOGRAFICA,,"28.705565, -16.215129",28.705565,-16.215129,28.583479893617024,-16.33721410638298,28.583479893617024,-16.33721410638298
"INFORME PATRIMONIAL DE LA MONTAÑA DEL DRAGO (SAN CRISTÓBAL DE LA LAGUNA, TENERIFE).",SAN CRISTOBAL DE LA LAGUNA,EN REDACCION,PATRIMONIO,,"28.707565, -16.213129",28.707565,-16.213129,28.51233423076923,-16.408359769230767,28.51233423076923,-16.408359769230767
SERVICIOS DE “VALORACIÓN PATRIMONIAL POSIBLES EVIDENCIAS ARQUEOLÓGICAS EN SUBSUELO DEL CASCO HISTÓRICO DE EL PASO” (LA PALMA).,EL PASO,EN REDACCION,PATRIMONIO,,"28.760700, -17.772700",28.7607,-17.7727,28.7257,-17.8077,28.7257,-17.8077
"INFORME PATRIMONIAL DE PUNTA BLANCA (GUÍA DE ISORA, TENERIFE)",GUIA DE ISORA,2022,PATRIMONIO,,"28.709565, -16.211129",28.709565,-16.211129,28.473031666666667,-16.447662333333334,28.473031666666667,-16.447662333333334
"INFORME DE IMPACTO PATRIMONIAL DEL PROYECTO FOTOVOLTAICO EN LA ZONA DE TAGORO, ARICO.",ARICO,2022,PATRIMONIO,,"28.711565, -16.209129",28.711565,-16.209129,28.485038684210526,-16.43565531578947,28.485038684210526,-16.43565531578947
ASESORÍA TÉCNICA PARA CREACIÓN DE UN PARQUE ARQUEOLÓGICO EN EL BIC DE ZONA ARQUEOLÓGICA DE LA BARRANQUERA,SAN CRISTOBAL DE LA LAGUNA,2021,PATRIMONIO,,"28.713565, -16.207129",28.713565,-16.207129,28.51233423076923,-16.408359769230767,28.51233423076923,-16.408359769230767
"REDACCIÓN DEL CATÁLOGO DE PATRIMONIO DE ANTIGUA (CATÁLOGOS ARQUEOLÓGICO, CATÁLOGO ETNOGRÁFICO Y CATÁLOGO PALEONTOLÓGICO). FUERTEVENTURA.",ANTIGUA,2020,PATRIMONIO,,"28.355300, -13.994700",28.3553,-13.9947,28.3428,-14.007200000000001,28.3428,-14.007200000000001
ESTUDIO TÉCNICO DE PROSPECCIÓN ARQUEOLÓGICA (INFORME DE IMPACTO ARQUEOLÓGICO) DE PROYECTO DE PARQUE EÓLICO SAN JUAN EN ARICO. TENERIFE,ARICO,2019,PATRIMONIO,,"28.715565, -16.205129",28.715565,-16.205129,28.485038684210526,-16.43565531578947,28.485038684210526,-16.43565531578947
ESTUDIO TÉCNICO DE PROSPECCIÓN ARQUEOLÓGICA (INFORME DE IMPACTO ARQUEOLÓGICO) DE PROYECTOS DE PARQUES EÓLICOS EN ARICO. TENERIFE,ARICO,2017,PATRIMONIO,,"28.717565, -16.203129",28.717565,-16.203129,28.485038684210526,-16.43565531578947,28.485038684210526,-16.43565531578947
ESTUDIO TÉCNICO DE PROSPECCIÓN ARQUEOLÓGICA (INFORME DE IMPACTO ARQUEOLÓGICO) DE PROYECTO DE URBANIZACIÓN SECTOR COSTA SAN JUAN. GUÍA DE ISORA. TENERIFE,GUIA DE ISORA,2017,PATRIMONIO,,"28.719565, -16.201129",28.719565,-16.201129,28.473031666666667,-16.447662333333334,28.473031666666667,-16.447662333333334
DISEÑO DE CONTENIDOS PARA EXPOSICIÓN ITINERANTE “LAGARES ANTIGUOS DE TENERIFE”.,SANTA CRUZ DE TENERIFE,2016,PATRIMONIO,,"28.721565, -16.199129",28.721565,-16.199129,28.583479893617024,-16.33721410638298,28.583479893617024,-16.33721410638298
ESTUDIO TÉCNICO DE PROSPECCIÓN ARQUEOLÓGICA (INFORME DE IMPACTO ARQUEOLÓGICO) DE PROYECTOS DE PARQUES EÓLICOS EN ARICO,ARICO,2016,PATRIMONIO,,"28.723565, -16.197129",28.723565,-16.197129,28.485038684210526,-16.43565531578947,28.485038684210526,-16.43565531578947
PROYECTO DE REHABILITACIÓN E INTERPRETACIÓN DEL CAMINO TRADICIONAL DE LAS LAJAS (SAN MIGUEL DE ABONA),SAN MIGUEL DE ABONA,2010,PATRIMONIO,,"28.725565, -16.195129",28.725565,-16.195129,28.558565,-16.362129,28.558565,-16.362129
PROYECTO DE REHABILITACIÓN E INTERPRETACIÓN DEL CAMINO TRADICIONAL DE LA FUENTE DE TAMAIDE (SAN MIGUEL DE ABONA),SAN MIGUEL DE ABONA,2009,PATRIMONIO,,"28.727565, -16.193129",28.727565,-16.193129,28.558565,-16.362129,28.558565,-16.362129
INFORME ARQUEOLÓGICO FINCA MARZAGÁN –ARICO (TENERIFE),ARICO,2007,PATRIMONIO,,"28.729565, -16.191129",28.729565,-16.191129,28.485038684210526,-16.43565531578947,28.485038684210526,-16.43565531578947
RECOGIDA MATERIALES ARQUEOLÓGICOS FINCA EL BAILADERO-ARICO (TENERIFE),ARICO,2007,PATRIMONIO,,"28.731565, -16.189129",28.731565,-16.189129,28.485038684210526,-16.43565531578947,28.485038684210526,-16.43565531578947
INFORME ARQUEOLÓGICO PARCELAS EN MUNICIPIO DE ARICO (TENERIFE),ARICO,2007,PATRIMONIO,,"28.733565, -16.187129",28.733565,-16.187129,28.485038684210526,-16.43565531578947,28.485038684210526,-16.43565531578947
